{
    "ark": "ark:/21198/z19k5vzb",
    "reconstruction": false,
    "type": {
        "id": "manuscript",
        "label": "Manuscript"
    },
    "shelfmark": "Sinai Syriac 42",
    "extent": "279 ff.",
    "weight": "917.1 g",
    "dim": "172 x 131 x 78.0 mm",
    "state": {
        "id": "codex",
        "label": "Codex"
    },
    "part": [
        {
            "label": "Codicological Unit",
            "support": [
                {
                    "id": "paper",
                    "label": "Paper"
                },
                {
                    "id": "parchment",
                    "label": "Parchment"
                }
            ],
            "layer": [
                {
                    "id": "ark:/21198/s1kd03",
                    "label": "Overtext Layer",
                    "type": {
                        "id": "overtext",
                        "label": "Overtext"
                    },
                    "locus": "<NA>"
                }
            ]
        }
    ],
    "location": [
        {
            "id": "sinai-oc",
            "collection": "Old Collection",
            "repository": "St. Catherine's Monastery of the Sinai"
        }
    ],
    "note": [
        {
            "type": {
                "id": "support",
                "label": "Support Note"
            },
            "value": "Ff. 190-220, 226-241 are parchment"
        }
    ],
    "bib": [
        {
            "id": "deb668b6-feec-4828-8749-a97441881226",
            "type": {
                "id": " ref",
                "label": "Reference"
            },
            "range": "[147], p. 157"
        }
    ],
    "iiif": [
        {
            "type": {
                "id": "main",
                "label": "Main"
            },
            "manifest": "https://iiif.library.ucla.edu/ark%3A%2F21198%2Fz19k5vzb/manifest",
            "text_direction": "right-to-left",
            "behavior": "paged",
            "thumbnail": "https://iiif.sinaimanuscripts.library.ucla.edu/iiif/2/ark%3A%2F21198%2Fz19k5vzb%2Fm0373187/full/!200,200/0/default.jpg"
        }
    ]
}