{
    "ark": "ark:/21198/z1st8t3m",
    "reconstruction": false,
    "type": {
        "id": "manuscript",
        "label": "Manuscript"
    },
    "shelfmark": "Sinai Arabic 499",
    "extent": "203 ff.",
    "weight": "591.1 g",
    "dim": "182 x 161 x 62 mm",
    "state": {
        "id": "codex",
        "label": "Codex"
    },
    "part": [
        {
            "label": "Codicological Unit",
            "support": [
                {
                    "id": "paper",
                    "label": "Paper"
                }
            ],
            "layer": [
                {
                    "id": "ark:/21198/s1pg7c",
                    "label": "Overtext Layer",
                    "type": {
                        "id": "overtext",
                        "label": "Overtext"
                    },
                    "locus": "<NA>"
                }
            ]
        }
    ],
    "location": [
        {
            "id": "sinai-oc",
            "collection": "Old Collection",
            "repository": "St. Catherine's Monastery of the Sinai"
        }
    ],
    "note": [
        {
            "type": {
                "id": "foliation",
                "label": "Foliation Note"
            },
            "value": "Foliation starts from f. 7"
        },
        {
            "type": {
                "id": "condition",
                "label": "Condition Note"
            },
            "value": "Ff. 1â€“6 apparently torn out/lost"
        },
        {
            "type": {
                "id": "contents",
                "label": "Contents Note"
            },
            "value": "Ff. 33v, back board inside filled with Arabic writing in a different hand"
        }
    ],
    "bib": [
        {
            "id": "deb668b6-feec-4828-8749-a97441881226",
            "type": {
                "id": " ref",
                "label": "Reference"
            },
            "range": "[426], p. 34"
        }
    ],
    "iiif": [
        {
            "type": {
                "id": "main",
                "label": "Main"
            },
            "manifest": "http://iiif.library.ucla.edu/ark%3A%2F21198%2Fz1st8t3m/manifest",
            "text_direction": "right-to-left",
            "behavior": "paged",
            "thumbnail": "https://iiif.sinaimanuscripts.library.ucla.edu/iiif/2/ark%3A%2F21198%2Fz1st8t3m%2F5d33p893/full/!200,200/0/default.jpg"
        }
    ]
}