{
    "ark": "ark:/21198/z1np37q4",
    "reconstruction": false,
    "type": {
        "id": "manuscript",
        "label": "Manuscript"
    },
    "shelfmark": "Sinai Arabic 89",
    "extent": "240 ff.",
    "weight": "966.3 g",
    "dim": "189 x 144 x 70 mm",
    "state": {
        "id": "codex",
        "label": "Codex"
    },
    "part": [
        {
            "label": "Codicological Unit",
            "support": [
                {
                    "id": "paper",
                    "label": "Paper"
                }
            ],
            "layer": [
                {
                    "id": "ark:/21198/s11k5r",
                    "label": "Overtext Layer",
                    "type": {
                        "id": "overtext",
                        "label": "Overtext"
                    },
                    "locus": "<NA>"
                }
            ]
        }
    ],
    "location": [
        {
            "id": "sinai-oc",
            "collection": "Old Collection",
            "repository": "St. Catherine's Monastery of the Sinai"
        }
    ],
    "note": [
        {
            "type": {
                "id": "para",
                "label": "Paracontent Note"
            },
            "value": "Reader and supplicant inscriptions, f. 1r | Reader inscription, f. 193v | Inscription (Coptic?), f. 194v"
        },
        {
            "type": {
                "id": "foliation",
                "label": "Foliation Note"
            },
            "value": "ff. 202 and 223 lacking"
        }
    ],
    "bib": [
        {
            "id": "deb668b6-feec-4828-8749-a97441881226",
            "type": {
                "id": " ref",
                "label": "Reference"
            },
            "range": "[82], p. 14"
        },
        {
            "id": "ec7c937f-655a-4459-b327-3793637b9db9",
            "type": {
                "id": "otherdigversion",
                "label": "Other Digital Version"
            },
            "url": "https://www.loc.gov/item/0027938670A-ms/"
        }
    ],
    "iiif": [
        {
            "type": {
                "id": "main",
                "label": "Main"
            },
            "manifest": "http://iiif.library.ucla.edu/ark%3A%2F21198%2Fz1np37q4/manifest",
            "text_direction": "right-to-left",
            "behavior": "paged",
            "thumbnail": "https://iiif.sinaimanuscripts.library.ucla.edu/iiif/2/ark%3A%2F21198%2Fz1np37q4%2F9c34v405/full/!200,200/0/default.jpg"
        }
    ]
}