{
    "ark": "ark:/21198/z1pg39cq",
    "reconstruction": false,
    "type": {
        "id": "manuscript",
        "label": "Manuscript"
    },
    "shelfmark": "Sinai Arabic 238",
    "extent": "371 ff.",
    "weight": "1255.3 g",
    "dim": "181 x 148 x 92.0 mm",
    "state": {
        "id": "codex",
        "label": "Codex"
    },
    "part": [
        {
            "label": "Codicological Unit",
            "support": [
                {
                    "id": "paper",
                    "label": "Paper"
                }
            ],
            "layer": [
                {
                    "id": "ark:/21198/s1rg70",
                    "label": "Overtext Layer",
                    "type": {
                        "id": "overtext",
                        "label": "Overtext"
                    },
                    "locus": "<NA>"
                }
            ]
        }
    ],
    "location": [
        {
            "id": "sinai-oc",
            "collection": "Old Collection",
            "repository": "St. Catherine's Monastery of the Sinai"
        }
    ],
    "bib": [
        {
            "id": "deb668b6-feec-4828-8749-a97441881226",
            "type": {
                "id": " ref",
                "label": "Reference"
            },
            "range": "[297], p. 25"
        },
        {
            "id": "f3ea9df2-bf85-465c-ac1d-6bd4cce71e21",
            "type": {
                "id": "otherdigversion",
                "label": "Other Digital Version"
            },
            "alt_shelf": "https://www.nli.org.il/en/manuscripts/NNL_ALEPH990038714010205171//NLI",
            "url": "nan"
        }
    ],
    "iiif": [
        {
            "type": {
                "id": "main",
                "label": "Main"
            },
            "manifest": "https://ingest.iiif.library.ucla.edu/ark%3A%2F21198%2Fz1pg39cq/manifest",
            "text_direction": "right-to-left",
            "behavior": "paged",
            "thumbnail": "https://iiif.sinaimanuscripts.library.ucla.edu/iiif/2/ark%3A%2F21198%2Fz1pg39cq%2Fg228zw0g/full/!200,200/0/default.jpg"
        }
    ]
}