{
    "ark": "ark:/21198/z1dj76t1",
    "reconstruction": false,
    "type": {
        "id": "manuscript",
        "label": "Manuscript"
    },
    "shelfmark": "Sinai Arabic 481",
    "extent": "338 ff.",
    "weight": "2754.9 g",
    "dim": "268 x 199 x 128.0 mm",
    "state": {
        "id": "codex",
        "label": "Codex"
    },
    "part": [
        {
            "label": "Codicological Unit",
            "support": [
                {
                    "id": "paper",
                    "label": "Paper"
                }
            ],
            "layer": [
                {
                    "id": "ark:/21198/s1w60t",
                    "label": "Overtext Layer",
                    "type": {
                        "id": "overtext",
                        "label": "Overtext"
                    }
                }
            ]
        }
    ],
    "location": [
        {
            "id": "sinai-oc",
            "collection": "Old Collection",
            "repository": "St. Catherine's Monastery of the Sinai"
        }
    ],
    "bib": [
        {
            "id": "deb668b6-feec-4828-8749-a97441881226",
            "type": {
                "id": " ref",
                "label": "Reference"
            },
            "range": "[416], p. 33"
        }
    ],
    "iiif": [
        {
            "type": {
                "id": "main",
                "label": "Main"
            },
            "manifest": "https://iiif.library.ucla.edu/ark%3A%2F21198%2Fz1dj76t1/manifest",
            "text_direction": "right-to-left",
            "behavior": "paged",
            "thumbnail": "https://iiif.sinaimanuscripts.library.ucla.edu/iiif/2/ark%3A%2F21198%2Fz1dj76t1%2F3942m48n/full/!200,200/0/default.jpg"
        }
    ]
}