{
    "ark": "ark:/21198/z15b1m5z",
    "reconstruction": false,
    "type": {
        "id": "manuscript",
        "label": "Manuscript"
    },
    "shelfmark": "Sinai Syriac 6",
    "extent": "170 ff.",
    "weight": "1671.8 g",
    "dim": "244 x 204 x 90.0 mm",
    "state": {
        "id": "codex",
        "label": "Codex"
    },
    "part": [
        {
            "label": "Codicological Unit",
            "support": [
                {
                    "id": "parchment",
                    "label": "Parchment"
                }
            ],
            "layer": [
                {
                    "id": "ark:/21198/s16911",
                    "label": "Overtext Layer",
                    "type": {
                        "id": "overtext",
                        "label": "Overtext"
                    },
                    "locus": "<NA>"
                }
            ]
        }
    ],
    "location": [
        {
            "id": "sinai-oc",
            "collection": "Old Collection",
            "repository": "St. Catherine's Monastery of the Sinai"
        }
    ],
    "note": [
        {
            "type": {
                "id": "contents",
                "label": "Contents Note"
            },
            "value": "Palimpsests throughout"
        }
    ],
    "bib": [
        {
            "id": "deb668b6-feec-4828-8749-a97441881226",
            "type": {
                "id": " ref",
                "label": "Reference"
            },
            "range": "[77], p. 154"
        }
    ],
    "iiif": [
        {
            "type": {
                "id": "main",
                "label": "Main"
            },
            "manifest": "https://ingest.iiif.library.ucla.edu/ark%3A%2F21198%2Fz15b1m5z/manifest",
            "text_direction": "right-to-left",
            "behavior": "paged",
            "thumbnail": "https://iiif.sinaimanuscripts.library.ucla.edu/iiif/2/ark%3A%2F21198%2Fz15b1m5z%2Fj207dp4s/full/!200,200/0/default.jpg"
        }
    ]
}