{
    "ark": "ark:/21198/z1zg8rqz",
    "reconstruction": false,
    "type": {
        "id": "manuscript",
        "label": "Manuscript"
    },
    "shelfmark": "Sinai Syriac NF X 5",
    "extent": "58 ff.",
    "weight": "211.6 g",
    "dim": "178 x 145 x 24.0 mm",
    "state": {
        "id": "codex",
        "label": "Codex"
    },
    "part": [
        {
            "label": "Codicological Unit",
            "support": [
                {
                    "id": "paper",
                    "label": "Paper"
                }
            ],
            "layer": [
                {
                    "id": "ark:/21198/s1f92k",
                    "label": "Overtext Layer",
                    "type": {
                        "id": "overtext",
                        "label": "Overtext"
                    }
                }
            ]
        }
    ],
    "location": [
        {
            "id": "sinai-nf",
            "collection": "New Finds",
            "repository": "St. Catherine's Monastery of the Sinai"
        }
    ],
    "note": [
        {
            "type": {
                "id": "condition",
                "label": "Condition Note"
            },
            "value": "The front pastedown consists of three leaves glued together"
        }
    ],
    "bib": [
        {
            "id": "220eeb5e-ef2f-4ddd-96e5-47e2220aa409",
            "type": {
                "id": " ref",
                "label": "Reference"
            },
            "range": "[X5N], pp. 109-113"
        }
    ],
    "iiif": [
        {
            "type": {
                "id": "main",
                "label": "Main"
            },
            "manifest": "https://iiif.library.ucla.edu/ark%3A%2F21198%2Fz1zg8rqz/manifest",
            "text_direction": "right-to-left",
            "behavior": "individuals",
            "thumbnail": "https://iiif.sinaimanuscripts.library.ucla.edu/iiif/2/ark%3A%2F21198%2Fz1zg8rqz%2F03630k90/full/!200,200/0/default.jpg"
        }
    ]
}