{
    "ark": "ark:/21198/z1fx8v69",
    "reconstruction": false,
    "type": {
        "id": "manuscript",
        "label": "Manuscript"
    },
    "shelfmark": "Sinai Arabic 217",
    "extent": "139 ff.",
    "weight": "432.7 g",
    "dim": "146 x 153 x 65.0 mm",
    "state": {
        "id": "codex",
        "label": "Codex"
    },
    "part": [
        {
            "label": "Codicological Unit",
            "support": [
                {
                    "id": "paper",
                    "label": "Paper"
                }
            ],
            "layer": [
                {
                    "id": "ark:/21198/s16p5b",
                    "label": "Overtext Layer",
                    "type": {
                        "id": "overtext",
                        "label": "Overtext"
                    },
                    "locus": "<NA>"
                }
            ]
        }
    ],
    "location": [
        {
            "id": "sinai-oc",
            "collection": "Old Collection",
            "repository": "St. Catherine's Monastery of the Sinai"
        }
    ],
    "bib": [
        {
            "id": "deb668b6-feec-4828-8749-a97441881226",
            "type": {
                "id": " ref",
                "label": "Reference"
            },
            "range": "[288], p. 24"
        },
        {
            "id": "f3ea9df2-bf85-465c-ac1d-6bd4cce71e21",
            "type": {
                "id": "otherdigversion",
                "label": "Other Digital Version"
            },
            "url": "https://www.nli.org.il/en/manuscripts/NNL_ALEPH990038916620205171//NLI"
        }
    ],
    "iiif": [
        {
            "type": {
                "id": "main",
                "label": "Main"
            },
            "manifest": "https://ingest.iiif.library.ucla.edu/ark%3A%2F21198%2Fz1fx8v69/manifest",
            "text_direction": "right-to-left",
            "behavior": "paged",
            "thumbnail": "https://iiif.sinaimanuscripts.library.ucla.edu/iiif/2/ark%3A%2F21198%2Fz1fx8v69%2Fbt08bv8s/full/!200,200/0/default.jpg"
        }
    ]
}