{
    "ark": "ark:/21198/z1v13pjk",
    "reconstruction": false,
    "type": {
        "id": "manuscript",
        "label": "Manuscript"
    },
    "shelfmark": "Sinai Arabic 461",
    "extent": "117 ff.",
    "weight": "789.6 g",
    "dim": "215 x 179 x 67.0 mm",
    "state": {
        "id": "codex",
        "label": "Codex"
    },
    "part": [
        {
            "label": "Codicological Unit",
            "support": [
                {
                    "id": "parchment",
                    "label": "Parchment"
                }
            ],
            "layer": [
                {
                    "id": "ark:/21198/s1jw3r",
                    "label": "Overtext Layer",
                    "type": {
                        "id": "overtext",
                        "label": "Overtext"
                    },
                    "locus": "<NA>"
                }
            ]
        }
    ],
    "location": [
        {
            "id": "sinai-oc",
            "collection": "Old Collection",
            "repository": "St. Catherine's Monastery of the Sinai"
        }
    ],
    "note": [
        {
            "type": {
                "id": "condition",
                "label": "Condition Note"
            },
            "value": "Ff. 26, 31 sewn together"
        },
        {
            "type": {
                "id": "contents",
                "label": "Contents Note"
            },
            "value": "Erased text f. 25av, 25br ; suspected palimpsest 25av"
        }
    ],
    "bib": [
        {
            "id": "deb668b6-feec-4828-8749-a97441881226",
            "type": {
                "id": " ref",
                "label": "Reference"
            },
            "range": "[521], p. 43"
        }
    ],
    "iiif": [
        {
            "type": {
                "id": "main",
                "label": "Main"
            },
            "manifest": "https://ingest.iiif.library.ucla.edu/ark%3A%2F21198%2Fz1v13pjk/manifest",
            "text_direction": "right-to-left",
            "behavior": "paged",
            "thumbnail": "https://iiif.sinaimanuscripts.library.ucla.edu/iiif/2/ark%3A%2F21198%2Fz1v13pjk%2Fhh630t2s/full/!200,200/0/default.jpg"
        }
    ]
}