{
    "ark": "ark:/21198/z1fn35q3",
    "reconstruction": false,
    "type": {
        "id": "manuscript",
        "label": "Manuscript"
    },
    "shelfmark": "Sinai Arabic NF X 6",
    "extent": "143 ff.",
    "weight": "384.4 g",
    "dim": "170 x 140 x 65.0 mm",
    "state": {
        "id": "codex",
        "label": "Codex"
    },
    "part": [
        {
            "label": "Codicological Unit",
            "support": [
                {
                    "id": "paper",
                    "label": "Paper"
                }
            ],
            "layer": [
                {
                    "id": "ark:/21198/s19g8b",
                    "label": "Overtext Layer",
                    "type": {
                        "id": "overtext",
                        "label": "Overtext"
                    }
                }
            ]
        }
    ],
    "location": [
        {
            "id": "sinai-nf",
            "collection": "New Finds",
            "repository": "St. Catherine's Monastery of the Sinai"
        }
    ],
    "bib": [
        {
            "id": "cb8b8b52-569b-4d1f-8d5c-adf911afd205",
            "type": {
                "id": " ref",
                "label": "Reference"
            },
            "range": "p. 38; ٤٠"
        }
    ],
    "iiif": [
        {
            "type": {
                "id": "main",
                "label": "Main"
            },
            "manifest": "https://iiif.library.ucla.edu/ark%3A%2F21198%2Fz1fn35q3/manifest",
            "text_direction": "right-to-left",
            "behavior": "paged",
            "thumbnail": "https://iiif.sinaimanuscripts.library.ucla.edu/iiif/2/ark%3A%2F21198%2Fz1fn35q3%2Ffw58dg6n/full/!200,200/0/default.jpg"
        }
    ]
}